{
  "schema": "flyto2.execution.v1",
  "invocation_id": "invocation-example-1",
  "capability": "test.run",
  "revision": 1,
  "status": "success",
  "started_at": "2026-09-30T00:00:00.000Z",
  "completed_at": "2026-09-30T00:00:05.000Z",
  "output": {
    "status": "completed",
    "exit_code": 0
  },
  "evidence": [
    {
      "kind": "process.log",
      "ref": "flyto2://evidence/job_0123456789abcdef0123456789abcdef"
    }
  ]
}
